{
  "schema_version": "avila.core/capability-manifest/v0.1",
  "capability_id": "specimen.openmc.transport",
  "capability_type": "nuclear.transport.neutron",
  "name": "OpenMC transport adapter — specimen",
  "provider": "Avila Labs",
  "version": "0.0.0-specimen",
  "maturity": "specimen",
  "execution": {
    "mode": "unavailable",
    "reason": "No transport adapter or qualified method is implemented in this scaffold."
  },
  "accepts": [
    "component_geometry",
    "material_definition",
    "irradiation_scenario"
  ],
  "produces": [
    "particle_flux"
  ],
  "qualification": {
    "status": "not_assessed",
    "scope": "No scope established.",
    "limitations": [
      "Manifest exists only to exercise Core's planning model."
    ]
  },
  "metadata": {
    "decision_use": "prohibited"
  }
}

