{
  "schema_version": "avila.core/capability-manifest/v0.1",
  "capability_id": "specimen.avify.bounds",
  "capability_type": "verification.continuous-bounds",
  "name": "Avify continuous uncertainty bounds — specimen",
  "provider": "Avila Labs",
  "version": "0.0.0-specimen",
  "maturity": "specimen",
  "execution": {
    "mode": "unavailable",
    "reason": "No Avify method is integrated or qualified for this hypothetical workflow."
  },
  "accepts": [
    "shutdown_dose_rate",
    "uncertainty_definition"
  ],
  "produces": [
    "shutdown_dose_rate_bound"
  ],
  "qualification": {
    "status": "not_assessed",
    "scope": "No scope established.",
    "limitations": [
      "No statement is made about mathematical soundness, tightness, or scalability."
    ]
  },
  "metadata": {
    "decision_use": "prohibited"
  }
}

